Argentina,775708403972866048,2016-09-13 14:51:10,"RT @gabimichetti: Reunión de trabajo con Daniel Herrero, Presidente de Toyota Argentina https://t.co/ezn7bT8am4"
Argentina,775707897837871104,2016-09-13 14:49:09,RT @Guillodietrich: En transporte tenemos todo por hacer: necesitamos inversión para reconstruir nuestra infraestructura y hacer crecer nue
Argentina,775707145618743296,2016-09-13 14:46:10,"RT @Guillodietrich: Las inversiones generan trabajo, aumentan la capacidad de producción del país y reducen los costos logísticos #Argentin"
Argentina,775706606566866944,2016-09-13 14:44:01,"Con Wayne Richardson, director global de Enirgi Group https://t.co/2WDqoisS9M"
Argentina,775705181602316289,2016-09-13 14:38:21,RT @cabrerafran: Estamos generando las condiciones de desarrollo para posicionar al país como un destino atractivo en el mapa global https:
Argentina,775705149968879616,2016-09-13 14:38:14,RT @cabrerafran: Nuestro objetivo es la generación de empleo. Necesitamos proyectos e inversiones que generen trabajo de calidad https://t.
Argentina,775704243990851584,2016-09-13 14:34:38,"RT @sergiobergman: Aprovecharemos esta oportunidad para que se invierta en #EnergíasRenovables y desarrollo sustentable, las claves del fut"
Argentina,775694384885035008,2016-09-13 13:55:27,"Ahora, en reunión con Andrew N. Liveris, Presidente y CEO de The Dow Chemical Company https://t.co/uoh0ptFX15"
Argentina,775689132261646338,2016-09-13 13:34:35,"Reunión con Ross Beaty, presidente de Pan American Silver y Eduardo Elsztain, presidente de IRSA https://t.co/cvPuWjNMKA"
Argentina,775686097720442880,2016-09-13 13:22:31,Conversando con medios locales https://t.co/nUWW3rUTXl
Argentina,775680102726307840,2016-09-13 12:58:42,Ahora: entrevista en vivo para Bloomberg https://t.co/eg7qQnMEM2
Argentina,775679450084151296,2016-09-13 12:56:06,"Queremos que sean parte de esta maravillosa etapa que ha empezado en la Argentina, que no es fruto de un gobierno, sino de una maduración."
Argentina,775679243036594176,2016-09-13 12:55:17,Este gobierno está para ayudarlos. Entendemos que al país lo sacamos adelante entre todos. https://t.co/akhIEHbEUx
Argentina,775678903297929216,2016-09-13 12:53:56,"Entendimos que a este maravilloso país, lleno de recursos humanos y naturales, debemos agregarle constancia. https://t.co/PgrqLFq37E"
Argentina,775678417815625728,2016-09-13 12:52:00,En el mundo se vuelve a hablar de la Argentina. Este foro es una invitación a todos los interesados en unirse a esta conversación.
Argentina,775678197165948928,2016-09-13 12:51:08,"Recibimos un país con inflación, empezamos a someterla. Se empiezan a ver los signos de que la recesión queda atrás https://t.co/USO8xovL66"
Argentina,775677102339264512,2016-09-13 12:46:47,"Su presencia y confianza ratifican esta nueva etapa de un país en marcha, donde nos miramos a nosotros y al mundo con optimismo."
Argentina,775676830376402945,2016-09-13 12:45:42,"Han venido 1900 personas de 67 países, líderes de compañías globales, emprendedores, representantes de gobierno de todo del país @Invest_ARG"
Argentina,775676195182608384,2016-09-13 12:43:10,Bienvenidos a todos. Quiero decirles que están en el lugar correcto en un momento perfecto. @Invest_ARG https://t.co/X5B0sHmBoq
Argentina,775663708215312384,2016-09-13 11:53:33,En minutos abrimos el primer Foro de Inversión y Negocios de la Argentina. @Invest_ARG https://t.co/ayWeGEhrNn
Argentina,775512938094428160,2016-09-13 01:54:27,Mañana empieza el primer Foro de Inversión y Negocios del país https://t.co/Rqfjqkqnb8
Argentina,775498649463844864,2016-09-13 00:57:40,Foro de Inversión y negocios: mañana se reúnen miles de líderes empresariales en nuestro país https://t.co/taW1x7yA4V
Argentina,775403797443215360,2016-09-12 18:40:46,"Recibimos al gobernador de Santa Fe, Miguel Lifschitz https://t.co/PXtC7rkpRu"
Argentina,775389069589217284,2016-09-12 17:42:14,Presentamos el Compromiso y la Ley de Desarrollo Cultural para darle oportunidades a los artistas de todo el país https://t.co/OfxC0i4Mba
Argentina,775078602597605376,2016-09-11 21:08:33,¡Feliz día a todos los maestros! Gracias por su dedicación y esfuerzo.
Argentina,775059295977271297,2016-09-11 19:51:50,"""Una nueva etapa"" https://t.co/pMgl7qkxaW"
Argentina,774993385212022784,2016-09-11 15:29:56,"""Los ojos del mundo están en la Argentina"" https://t.co/a9niIIlYUH"
Argentina,774786524177137664,2016-09-11 01:47:56,Impresionante Oscar Martínez. ¡Felicitaciones por el éxito en el Festival de Venecia!
Argentina,774349568301465600,2016-09-09 20:51:38,"Con @Anne_Hidalgo, alcaldesa de París y líder del C40, el foro de ciudades que trabaja contra el cambio climático https://t.co/u3nEnzG4J9"
Argentina,774276228262072320,2016-09-09 16:00:12,¡Felicitaciones Yanina por el primer oro en los #JuegosParalimpicos! ¡Vamos Argentina! #Río2016
Argentina,774266609993211908,2016-09-09 15:21:59,"En Punta Indio charlé con Pablo y Juan, los ingenieros del proyecto ISCUL para el lanzamiento de satélites livianos https://t.co/dFTEdYIyvK"
Argentina,774246628005904384,2016-09-09 14:02:35,"Ahora, recorriendo la Estación Espacial Punta Indio https://t.co/BlQMzmtNyj"
Argentina,773904085766512640,2016-09-08 15:21:27,"¡Feliz cumple @mariuvidal! Acá estamos ahora, en el taller de trenes de Llavallol https://t.co/eCkppJMHtV"
Argentina,773690452205764608,2016-09-08 01:12:32,RT @DXTVparatodos: EMOCIÓN PURA. Con @gustifernandez4 a la cabeza así entró la delegación nacional. ¡Vamos Argentina! #DXTVenRIO https://t.
Argentina,773620987392823296,2016-09-07 20:36:31,El Centro de Transferencia de Cargas ordenará la circulación de más de 3.500 camiones diarios y reducirá el tránsito pesado en la ciudad
Argentina,773620687353352192,2016-09-07 20:35:19,"Inauguramos el primer centro de logística de la CABA en Soldati, un proyecto que iniciamos en 2009 y hoy es realidad https://t.co/qYWGNKI3yN"
Argentina,773283416766877696,2016-09-06 22:15:08,Reuniones en Olivos https://t.co/z654p3JZRc
Argentina,772960467769851904,2016-09-06 00:51:51,El mundo mira con optimismo a la Argentina. https://t.co/1BoW3VLjEZ
Argentina,772839872558137344,2016-09-05 16:52:38,Esperamos seguir avanzando en la relación de nuestros países. #China
Argentina,772839757432979456,2016-09-05 16:52:11,"Gracias China por el esfuerzo puesto en la organización del
#G20 y por el cálido recibimiento."
Argentina,772839558262194178,2016-09-05 16:51:24,
Argentina,772839493397258241,2016-09-05 16:51:08,G20
Argentina,772806259154231296,2016-09-05 14:39:04,RT @KremlinRussia_E: #G20 #Hangzhou: Vladimir Putin met with President of Argentina Mauricio Macri https://t.co/SGAiRMZPNW https://t.co/cea
Argentina,772783218181435392,2016-09-05 13:07:31,"Reunión bilateral con Vladimir Putin, presidente de la Federación Rusa. #G20 https://t.co/hd1Au7osyM"
Argentina,772781914084220928,2016-09-05 13:02:20,"RT @marianorajoy: Con @mauriciomacri, presidente de Argentina. Dos países aliados y amigos con una magnífica relación bilateral #G20 https:"
Argentina,772781234435096576,2016-09-05 12:59:38,En sesión. @BarackObama #G20 https://t.co/XCFdTSlaa1
Argentina,772780162710659072,2016-09-05 12:55:23,RT @narendramodi: Met President @mauriciomacri &amp; had fruitful talks on increasing cooperation between India &amp; Argentina. https://t.co/vvH3s
Argentina,772779984561799168,2016-09-05 12:54:40,"Con la canciller alemana, Angela Merkel. #G20 https://t.co/jbofKu8tBE"
Argentina,772778462662782976,2016-09-05 12:48:37,"Volviendo a la sesión luego de la reunión bilateral con Narendra Modi, Primer Ministro de la India. #G20 https://t.co/BHh79gFJLr"
Argentina,772777566520414208,2016-09-05 12:45:04,Camino a la reunión bilateral con Mariano Rajoy. #G20 https://t.co/gksF4wwk4K
Argentina,772775597932179457,2016-09-05 12:37:14,"Con Justin Trudeau, Primer Ministro de Canadá, minutos antes de la sesión. https://t.co/Cdx8qqBiIs"
Argentina,772459388053426176,2016-09-04 15:40:44,Momentos antes de la foto oficial. #G20 https://t.co/qQz7xeQCpe
Argentina,772448955342913536,2016-09-04 14:59:17,"Apertura del G20 en Hangzhou, #China https://t.co/Lh8RI2Q7ik"
Argentina,772280786129186816,2016-09-04 03:51:02,"Recorrí Huawei con su titular, Yafang Sun. #China https://t.co/0pv5m3mVLM"
Argentina,772031520253087744,2016-09-03 11:20:32,Ahora: participando de la Cumbre de Negocios B20 #China https://t.co/4VxRGAWsNp
Argentina,771915334097993728,2016-09-03 03:38:51,Con el CEO del Grupo Gezhouba https://t.co/IUmuI2agI1
Argentina,771914533812207617,2016-09-03 03:35:40,Encuentro con el fundador y presidente del Grupo Sany https://t.co/bVwMLnj5gf
Argentina,771914177128591360,2016-09-03 03:34:15,Reunión con el Presidente de la Corporación Nuclear Nacional China https://t.co/OcPC87VXqv
Argentina,771912257332731904,2016-09-03 03:26:38,Audiencia con el presidente de Power China https://t.co/lArg6YJ4sC
Argentina,771880381830299648,2016-09-03 01:19:58,"Ahora: reunión bilateral con el presidente de la República Popular China, Xi Jinping https://t.co/oIEXq9UFdE"
Argentina,771544550380670976,2016-09-02 03:05:30,Llegamos a China https://t.co/WB8LyrOtfY
Argentina,771353382191788034,2016-09-01 14:25:52,Escala en Qatar antes de llegar a China para la cumbre G20 https://t.co/T4vjNXmGEr
Argentina,771054897118740480,2016-08-31 18:39:47,"Estas son las principales medidas del compromiso ""Argentina sin narcotráfico"" https://t.co/TRQePfez2g"
Argentina,770742193095110656,2016-08-30 21:57:13,Recibí a Margarita @Stolbizer esta tarde en Olivos https://t.co/iMxWOK40ih
Argentina,770641070434680832,2016-08-30 15:15:23,"Presentamos ""Argentina sin Narcotráfico"", un compromiso de gobierno, ONGs, la Iglesia y la sociedad para combatirlo https://t.co/PJxa7iHHJf"
Argentina,770313129154768896,2016-08-29 17:32:16,"Recibí a Rigoberta Menchú y a Shirin Ebadi, dos luchadoras de los DDHH reconocidas con el Premio Nobel de la Paz https://t.co/Cr7hhTQLSX"
Argentina,770302894511943680,2016-08-29 16:51:36,"Acompañando a Manaos en el anuncio de inversiones por 12 millones de dólares, que generarán 2 mil puestos de trabajo https://t.co/2ClIEi2xeg"
Argentina,770050469221765121,2016-08-29 00:08:33,https://t.co/E1g35cV4iO
Argentina,769377071655186433,2016-08-27 03:32:42,Acompañamos con gran preocupación la situación de los incendios en San Luis. Estamos a disposición de la provincia para ayudar.
Argentina,769267378496663553,2016-08-26 20:16:49,Plaza Logística invertirá 3.000 millones en los próximos dos años: https://t.co/V194SdJXe9 https://t.co/QUxgm9F0dv
Argentina,768807814768779264,2016-08-25 13:50:41,"Ahora, recorriendo el polo productivo de Ezeiza donde trabajan más de 90 cooperativistas https://t.co/noc6IedReD"
Argentina,768548560455467009,2016-08-24 20:40:30,En la quinta de Olivos con parte de la delegación olímpica argentina  https://t.co/OryGN3IRyU
Argentina,768537919124541440,2016-08-24 19:58:13,"RT @PrensaCOA: #JuegosOlímpicos Algunas imágenes del presidente Macri junto con los atletas olímpicos argentinos, en Olivos. https://t.co/L"
Argentina,768533317708840960,2016-08-24 19:39:56,Estamos a disposición del gobierno para colaborar en lo que consideren necesario frente a esta catástrofe que golpea a Italia
Argentina,768533232530911232,2016-08-24 19:39:35,Me comuniqué hoy con el Primer Ministro italiano para ofrecer las condolencias del pueblo argentino por las víctimas del terremoto
Argentina,768189837459517440,2016-08-23 20:55:04,Quilmes invertirá más de 26 mil millones en los próximos 5 años: https://t.co/KxqIfZTRRu https://t.co/IZgSMv67Uc
Argentina,768137344507600896,2016-08-23 17:26:28,"Recibí a Gabriel Rabinovich, científico destacado por su aporte en las terapias contra el cáncer https://t.co/JbVSC8TVYI"
Argentina,768123930481754112,2016-08-23 16:33:10,https://t.co/jvDlxCZQ3b
Argentina,768054888660099072,2016-08-23 11:58:49,Acompañamos a @mariuvidal en su tarea de sacar adelante la provincia de Buenos Aires. No nos van a parar.
Argentina,767826038260891650,2016-08-22 20:49:27,"Esta tarde recibimos en Casa Rosada a Martin Schulz, titular del Parlamento Europeo. https://t.co/ePRtfe6iuY"
Argentina,767731644350468098,2016-08-22 14:34:22,"Inauguramos el nuevo centro de distribución de Droguería del Sud, que generará más de 200 puestos de trabajo https://t.co/H6egFGPy7X"
Argentina,767374892828418053,2016-08-21 14:56:46,Protejamos a esa fuerza que nos impulsa. https://t.co/D0jBlQj24u
Argentina,767086730503675904,2016-08-20 19:51:42,https://t.co/9ejMTZpVP3
Argentina,767025763463888896,2016-08-20 15:49:27,Tocando timbres en San Miguel para charlar con los vecinos https://t.co/wuD1HhKbi5
Argentina,766801452652036096,2016-08-20 00:58:07,https://t.co/vPhanV87jJ
Argentina,766747583196848129,2016-08-19 21:24:03,"Recibí a los alumnos del ITBA ganadores del premio ""Climate Colab"" del Instituto Tecnológico de Massachusetts https://t.co/2uJJXq89G5"
Argentina,766391856691306496,2016-08-18 21:50:32,Histórico!!! Felicitaciones Leones por el #oro!! Vamos Argentina 
Argentina,766298414795677696,2016-08-18 15:39:13,Anunciamos en Tecnópolis los proyectos de ley para apoyar la actividad emprendedora https://t.co/5eTC9jURXp
Argentina,766075520354226176,2016-08-18 00:53:31,"Gracias por haberle dado tanto al país y al básquet, generación dorada. Los vamos a extrañar"
Argentina,766013859299725312,2016-08-17 20:48:30,https://t.co/LVT5XuBVc9
Argentina,765950805165891584,2016-08-17 16:37:57,En Luján de Cuyo anunciamos las obras para extender las redes cloacales a más de 8 mil vecinos de Perdriel https://t.co/0p6lG8vxS9
Argentina,765928901566685184,2016-08-17 15:10:55,"Homenajeamos al General San Martín en el Cerro de la Gloria, Mendoza https://t.co/uAoCABuly9"
Argentina,765661894980071424,2016-08-16 21:29:55,https://t.co/yE6KP6h6S0
Argentina,765639006075977728,2016-08-16 19:58:58,Felicitaciones Cecilia y Santiago por el oro!! Un ejemplo de esfuerzo y perseverancia para todos. #Vela 
Argentina,765610652220190720,2016-08-16 18:06:18,Felicitaciones a los Leones por hacer historia! Vamos Argentina!! 
Argentina,765580850524262400,2016-08-16 16:07:53,Selfie en las oficinas de @Mercadolibre https://t.co/wh8cfh5NIZ
Argentina,764984697357303809,2016-08-15 00:38:59,"Gracias por dejar todo, Delpo. Sos puro corazón y el campeón de todos nosotros. Felicitaciones y vamos Argentina!!"
Argentina,764567489888055296,2016-08-13 21:01:09,"La generación dorada sigue brillando! Los felicito, son unos grandes. Sí, se puede!"
Argentina,764567380408303616,2016-08-13 21:00:43,"Delpo! Qué emoción! Sí, se puede!"
Argentina,764509274978607104,2016-08-13 17:09:49,Hermanos brasileños: https://t.co/1CGlemEpM0 https://t.co/r1Lj1CLM8P
Argentina,764227289441763328,2016-08-12 22:29:19,Una gran noticia para el fútbol del mundo y toda la Argentina. Felicitaciones Lío y gracias!
Argentina,764187188540178433,2016-08-12 19:49:58,Llega el agua potable al Impenetrable. https://t.co/IILFaNSa12
Argentina,763454597096574976,2016-08-10 19:18:54,"Llamé a @paulipareto para felicitarla por la medalla de oro. #Judo
https://t.co/BMTthnz8Jt"
Argentina,763389705866084352,2016-08-10 15:01:03,EN DIRECTO en #Periscope: Ahora en vivo con @BuzzFeedEspanol https://t.co/0CJ9Eh3b4a
Argentina,763385239704113157,2016-08-10 14:43:18,En 20 minutos entrevista en vivo con BuzzFeed Español. Para verla: https://t.co/67heXYFxXU https://t.co/2Y1UcAD6Du
Argentina,763136556785885184,2016-08-09 22:15:08,"RT @BuzzFeedEspanol: ¿Qué le preguntarías a @mauriciomacri ?

Envíanos tus preguntas aquí: 
https://t.co/AyygFQ1SIl

#MacriConBuzzFeed http"
Argentina,763079546337890304,2016-08-09 18:28:35,La declaración como Reserva Natural de la Isla garantizará la protección de sus 52 mil hectáreas y su biodiversidad https://t.co/7HN6vWz0fu
Argentina,763078665773182976,2016-08-09 18:25:05,Tomamos la decisión de convertir la Isla de los Estados en una Reserva Natural Silvestre. #TierraDelFuego https://t.co/aAwjKGut2v
Argentina,763067485138583552,2016-08-09 17:40:40,"Recibimos a Peter Cosgrove, gobernador general de Australia, este mediodía en la Casa Rosada. https://t.co/1b5MoGuky7"
Argentina,762718906507223040,2016-08-08 18:35:32,Selfie en la inauguración de un nuevo Coto en Barracas https://t.co/MIk3pU4D91
Argentina,762672119213879296,2016-08-08 15:29:37,"Ahora, reunión con el Secretario General de las Naciones Unidas, Ban Ki-moon. https://t.co/aindtwXish"
Argentina,762472683376214016,2016-08-08 02:17:08,Una alegría inmensa por verte jugar así  @delpotrojuan. Un triunfo espectacular!! #VamosArgentina
Argentina,762311484315672577,2016-08-07 15:36:35,"Sin salud, todo lo demás no importa: https://t.co/6JhbpWXUj9"
Argentina,762021943658868736,2016-08-06 20:26:03,Felicitaciones @paulipareto por la medalla de oro! Un orgullo para todos. #Judo #Rio2016
Argentina,761911086182313984,2016-08-06 13:05:33,Alentando en la Villa Olímpica #VamosArgentina https://t.co/ysWFIZHFs1
Argentina,761757642901651468,2016-08-06 02:55:49,Felicitaciones a Brasil y a su gente por la espectacular fiesta inaugural. Muchísimo color y creatividad! #JuegosOlimpicos
Argentina,761737994973872128,2016-08-06 01:37:45,RT @delpotrojuan: #Rio2016 #JuegosOlimpicos https://t.co/dMaLL2VV0w
Argentina,761737786068234240,2016-08-06 01:36:55,RT @delfinamerino: Tremendo momento!!! @Rio2016 https://t.co/spw4JjX9Ut
Argentina,761736976605310976,2016-08-06 01:33:42,RT @manuginobili: Los dos más viejitos del básquet olímpico disfrutando del desfile.  https://t.co/UIUL8OMo3d
Argentina,761724428099153922,2016-08-06 00:43:50,"RT @sabatinigabyok: Vamos #ARG en #Rio2016 !Estaremos alentando y apoyándolos, mucha fuerza!! #OlympicGames #OpeningCeremony #orgullo  ht"
Argentina,761717726461165568,2016-08-06 00:17:12,Orgullo #JuegosOlimpicos  https://t.co/RbK3uCuVgM
Argentina,761695701680160770,2016-08-05 22:49:41,"En el Palacio Itamaraty con el jefe de Estado de Brasil, Michel Temer https://t.co/QUHuwyMUtf"
Argentina,761674508373790721,2016-08-05 21:25:28,RT @LScola4: Allá vamos... https://t.co/5ZUWKGivSu
Argentina,761668183325569024,2016-08-05 21:00:20,Acompaño a los deportistas que nos representarán con el orgullo de vestir la camiseta argentina y compitiendo sanamente. #Rio2016
Argentina,761668039796486144,2016-08-05 20:59:46,"El deporte es tan bueno para educar, porque todo en la vida requiere de un esfuerzo, de una decisión y superación personal. #Rio2016"
Argentina,761667924281131008,2016-08-05 20:59:18,"Después de una etapa de tantos años de confrontación, tenemos que unirnos y el deporte es una muy linda excusa para hacerlo. #Rio2016"
Argentina,761667711864827905,2016-08-05 20:58:28,"Los Juegos Olímpicos son un evento único que convoca a todo el mundo, que nos une en un instante de una manera distinta. #Rio2016"
Argentina,761586319302791168,2016-08-05 15:35:02,"RT @SC_ESPN: #Ahora, en ESPN 2: @mauriciomacri en los estudios de #ESPN. https://t.co/gt1MAFmjDB"
Argentina,761584050289139713,2016-08-05 15:26:01,RT @manuginobili: Foto oficial de la Selección antes del debut.  Todo listo en Río!  https://t.co/uyoqWBQnyQ
Argentina,761575576440274944,2016-08-05 14:52:21,Entrevista con @gonbonadeo1963 para @TyCSports #Rio2016 https://t.co/oBS2iq6Is7
Argentina,761227070190055425,2016-08-04 15:47:31,"Ahora, con John Kerry, Secretario de Estado de los Estados Unidos https://t.co/DSKHUHEdgR"
Argentina,761195697966284800,2016-08-04 13:42:51,Reunión de gabinete ampliado en Casa Rosada https://t.co/zLor2ddrut
Argentina,760949005941637121,2016-08-03 21:22:35,"Con el Gobernador General de Nueva Zelanda, Jerry Mateparae, en la residencia de Olivos. https://t.co/FTsQWYQrl3"
Argentina,760934274451247105,2016-08-03 20:24:03,"Recibí a Andrej Kiska, presidente de la República Eslovaca, para avanzar en las relaciones entre el Mercosur y la UE https://t.co/5wDCU2aSZ7"
Argentina,760884326892462080,2016-08-03 17:05:34,Recorrimos las obras del tramo Chacabuco-Junín de la Ruta Nacional 7 https://t.co/hkPCZiEXwS
Argentina,760665149531361280,2016-08-03 02:34:38,15 millones de personas contarán con mejor cobertura de salud: https://t.co/EFFqwCYzk2
Argentina,760564267255009280,2016-08-02 19:53:46,Firmamos la adhesión del gob. argentino a la Declaración de Chapultepec sobre la defensa de la libertad de expresión https://t.co/s1sqSIFi9E
Argentina,760524876130062336,2016-08-02 17:17:14,"El Aeropuerto de Córdoba tiene una nueva terminal para pasajeros
https://t.co/Hrku965P48"
Argentina,760495618997514241,2016-08-02 15:20:59,"Inauguramos la nueva terminal de pasajeros del Aeropuerto de Córdoba, el tercero más transitado del país https://t.co/sIRLmA29KG"
Argentina,760284469509099520,2016-08-02 01:21:57,Encabezando la Cena Anual de Camaradería de las Fuerzas Armadas https://t.co/R3V0C9QEh9
Argentina,760127458616172544,2016-08-01 14:58:03,La obra pública no tiene por qué ser corrupta: https://t.co/1ZKCwSQj8j
Argentina,759417515500007424,2016-07-30 15:56:59,"""No hay otro camino si no es la unidad de los argentinos"" https://t.co/TlsWtRHNJL"
Argentina,759417177070047236,2016-07-30 15:55:38,"""Podemos ser un gran protagonista en el mundo para dar respuesta a los problemas de seguridad alimentaria. Depende de nosotros"""
Argentina,759417018873475072,2016-07-30 15:55:01,"""Somos y podemos ser, cada día más, un proveedor confiable del mundo. El mundo nos abrió los brazos, confía en nuestra capacidad"""
Argentina,759416763843043333,2016-07-30 15:54:00,"""Este es un país federal y lo vamos a practicar como corresponde, trabajando en equipo con cada gobernador"" https://t.co/xtjfLMgjIJ"
Argentina,759416429313716224,2016-07-30 15:52:40,"""Agradezco profundamente el entendimiento de los argentinos, el apoyo en estos duros momentos. Gracias de corazón"" https://t.co/4Qh5gxRttO"
Argentina,759415691661471745,2016-07-30 15:49:44,"""La gente de campo sabe lo que es cuidar una semilla para que surja una planta donde no existía. Lo mismo debemos hacer con la confianza"""
Argentina,759414980919918592,2016-07-30 15:46:55,"""El campo es mucho más que lo que puede producir, que los impuestos que puede pagar. Es nuestra historia, nuestra cultura, es solidaridad"""
Argentina,759414774304280576,2016-07-30 15:46:06,Desde hace 7 meses trabajamos para que el campo sienta que se le ha sacado la pata de encima y se le tiende la mano https://t.co/BpVTMbXySw
Argentina,759414373194530816,2016-07-30 15:44:30,"Podemos decir con alegría que se terminó el ""ellos"" o ""nosotros"". Ahora somos un mismo equipo tirando el carro para hacer crecer al país"
Argentina,759414031572725760,2016-07-30 15:43:09,"""Comenzamos una nueva etapa en nuestro país, basada en crecer, en desarrollarnos y disminuir la pobreza para hacer un país más justo"""
Argentina,759413789406134272,2016-07-30 15:42:11,"""A todos los argentinos les quiero decir la enorme importancia que tiene el campo para este país, especialmente en este momento"""
Argentina,759390784839974912,2016-07-30 14:10:46,"Ahora, en la inauguración de la Exposición Rural. https://t.co/wOVZpokM8G"
Argentina,759160374557970432,2016-07-29 22:55:12,"La visita del Presidente Enrique Peña Nieto
https://t.co/h1rrbTWZbu"
Argentina,759104364392751104,2016-07-29 19:12:38,"Declaración conjunta con el Presidente Peña Nieto
https://t.co/3Mhok5Nphz"
Argentina,759043475711008768,2016-07-29 15:10:41,"Visita de Estado del Presidente de México, Enrique Peña Nieto https://t.co/22YjG76ckt"
Argentina,758817047820197888,2016-07-29 00:10:56,"Recibí al Emir de Qatar, Tamim Bin Hamad Al Thani, en la Quinta de Olivos https://t.co/z0duUJaOlC"
Argentina,758710231354449920,2016-07-28 17:06:29,Participando en la asunción de @ppkamigo https://t.co/mcAhaZ8FLd
Argentina,758452105174745088,2016-07-28 00:00:47,Llegamos a Perú para asistir a la asunción de @ppkamigo https://t.co/QOJELg4jyG
Argentina,758399535605354496,2016-07-27 20:31:54,"Conectados con la Fragata Libertad a través de Skype
https://t.co/3zrqvqrpKX"
Argentina,758333168143462400,2016-07-27 16:08:11,Terminó la reunión con @cuervotinelli https://t.co/2tawCnTYii
Argentina,758319020999344128,2016-07-27 15:11:58,"Ahora, recibiendo a @cuervotinelli en Olivos https://t.co/ReErlLH2ni"
Argentina,758297141290860544,2016-07-27 13:45:01,Skype Dublin - Buenos Aires con la tripulación de la Fragata Libertad https://t.co/pFZyLoaa67
Argentina,758064545155821568,2016-07-26 22:20:46,"Un plan nacional para erradicar la violencia contra las mujeres: https://t.co/IF9yIftJvI
https://t.co/9JUJtAvMYN"
Argentina,757702377898213376,2016-07-25 22:21:38,"Hoy recibimos en la Casa Rosada a José Vivanco, director para América de Human Rights Watch https://t.co/RGDG4GJ7oF"
Argentina,757683675194462210,2016-07-25 21:07:19,"Recorrimos las instalaciones de INTA Castelar para conocer los avances en investigación e innovación en el campo
https://t.co/APu0NnZNDC"
Argentina,757590878894587905,2016-07-25 14:58:35,Selfie en la recorrida por el INTA Castelar https://t.co/ESTBVWKQbM
Argentina,757398676440571905,2016-07-25 02:14:50,"""Tenemos todo para hacer un gran país y lo vamos a hacer"" #PPT"
Argentina,757398589157048320,2016-07-25 02:14:30,"""Con tanta gente en la pobreza cada día cuenta. No es lo mismo hacer las cosas mañana que dentro de un mes"" #PPT"
Argentina,757398470768619521,2016-07-25 02:14:01,"""Tenemos una oportunidad como pocas. Depende de nosotros marcar el rumbo"" #PPT"
Argentina,757396856649478144,2016-07-25 02:07:37,"""No se juega con la inflación, un impuesto perverso que se cobra a la gente más pobre"" #PPT"
Argentina,757396692480233473,2016-07-25 02:06:57,"""Las PyMEs son las que van a generar más del 60% del nuevo empleo, vamos a acompañarlas"" #PPT"
