Argentina,908122365455937536,2017-09-14 00:16:58,En Rafaela recorrimos las obras que van a transformar en autopista el tramo Rosario-Sunchales de la RN 34 https://t.co/uMaJeAAPE4
Argentina,908024294353108994,2017-09-13 17:47:16,En Quimilí inauguramos la planta potabilizadora que abastecerá a más de 15 mil vecinos https://t.co/xH8vudOjfw
Argentina,907976488791810048,2017-09-13 14:37:18,En vivo desde Santiago del Estero: inauguración del hogar Isidro Antúnez de la Fundación Margarita Barrientos https://t.co/QUnV6ijhev
Argentina,907730092008378368,2017-09-12 22:18:13,Nos reunimos con el presidente Cartes y el titular de CONMEBOL para avanzar en la presentación común junto a Urugua https://t.co/VMEumdd5bu
Argentina,907708790933479425,2017-09-12 20:53:34,"RT @netanyahu: President @mauriciomacri, my friend, thank you for the warm welcome. Together we will bring Israel-Argentina relations to ne"
Argentina,907708305593774080,2017-09-12 20:51:39,Recibimos la primera visita de un primer ministro israelí a la Argentina https://t.co/6m2mYjRjih
Argentina,907688227561197568,2017-09-12 19:31:52,Entregué al primer ministro Netanyahu 139 mil documentos producidos por la Cancillería argentina entre 1939 y 1950 https://t.co/gayej9R2SL
Argentina,907628784312037376,2017-09-12 15:35:39,En vivo: declaración conjunta del primer ministro Benjamin Netanyahu y el presidente Macri  https://t.co/9C15DNLPhw https://t.co/zUuXJqkrDy
Argentina,907611184559525893,2017-09-12 14:25:43,En vivo: llegada del primer ministro Benjamin Netanyahu https://t.co/O58qb0TVio
Argentina,907302814933712896,2017-09-11 18:00:22,"Nos reunimos con Luis Alberto Moreno, presidente del Banco Interamericano de Desarrollo https://t.co/B5iXIbzvG2"
Argentina,907255424315002881,2017-09-11 14:52:03,"¡Feliz día a todos los maestros argentinos! Nuestro reconocimiento a su tarea, su amor y su compromiso"
Argentina,906213214907768832,2017-09-08 17:50:41,Solidaridad con México en este difícil momento. Acompañamos a los familiares de las víctimas y ofrecemos nuestro apoyo al gobierno. @EPN
Argentina,906186180903010305,2017-09-08 16:03:16,En vivo: presentación del programa de microcréditos para jóvenes emprendedores https://t.co/T2XtxKH56o https://t.co/v3y2HbYGHu
Argentina,905815765139562497,2017-09-07 15:31:22,"Recibimos en Casa Rosada a Maximiliano Villalba, tesorero de la Cooperativa de Cartoneros de Villa Itatí https://t.co/DEN5mys62x"
Argentina,905545524379574272,2017-09-06 21:37:31,Hoy recorrimos las obras del viaducto de puente La Noria https://t.co/4XDificeFk
Argentina,905044989348065280,2017-09-05 12:28:35,En vivo: puesta en marcha de las obras del Viaducto Mitre https://t.co/5ECQ3dN12b
Argentina,904858826477887488,2017-09-05 00:08:50,Celebración por los 500 años de la Reforma Protestante en el Teatro Colón https://t.co/e24MNSx8Nr
Argentina,904730208711868418,2017-09-04 15:37:45,"En vivo: entrega de premios ""Maestros Argentinos"" https://t.co/UzeZGqVsyL"
Argentina,904448854279557120,2017-09-03 20:59:45,Condeno la prohibición de la salida de @liliantintori. No podrán callar la voz del pueblo venezolano. Democracia para Venezuela
Argentina,903635288471347200,2017-09-01 15:06:56,En vivo: inauguración de las obras en el aeropuerto de Tucumán https://t.co/639FkjvBjz https://t.co/qxzy8ZUbQX
Argentina,903364461616132100,2017-08-31 21:10:46,"Recibí a Darren Woods, presidente y director ejecutivo de Exxon Mobil https://t.co/RFvsgZi5ho"
Argentina,903347500425388032,2017-08-31 20:03:22,Un saludo especial a toda la comunidad islámica que en el día de hoy comenzará a festejar el Eid al-Adha. ¡´Id Mubarak!
Argentina,903330941661323264,2017-08-31 18:57:34,Inauguración de la nueva central termoeléctrica de Pampa Energía en el Parque Industrial Pilar https://t.co/wwFL7NwIqy
Argentina,903280530732568576,2017-08-31 15:37:15,En vivo: el Presidente en el acto del Día de la Industria https://t.co/OpuPmjj0na
Argentina,902988317343535104,2017-08-30 20:16:06,En Florencio Varela recorrimos las obras de un nuevo paso bajo nivel que beneficiará a más de mil peatones y 10 mil https://t.co/LPYyaqHMML
Argentina,902887739930050560,2017-08-30 13:36:26,En vivo: el Presidente y la gobernadora María Eugenia Vidal presentan el programa Casas de Encuentro Comunitario https://t.co/v7rsE3KE2Z
Argentina,902516928060813313,2017-08-29 13:02:58,En vivo: firma del acuerdo sectorial para la promoción de la biotecnología https://t.co/ZW5WhdeYtM
Argentina,902184747207675904,2017-08-28 15:03:00,Encuentro en Casa Rosada con mujeres que dirigen PyMEs https://t.co/oLPaZJPtgg
Argentina,901172809384243201,2017-08-25 20:01:55,"El rugby inclusivo, el vóley sub 23 y Delfina Pignatiello (natación juvenil) ganaron hoy medallas de oro para la Argentina ¡Felicitaciones!"
Argentina,900854718376931329,2017-08-24 22:57:56,A 30 años de la fundación del hospital Garrahan recibimos a los médicos Marcelo Scopinaro y Horacio Vogelfang en Ca https://t.co/IhQdWzox8a
Argentina,900744600176001024,2017-08-24 15:40:22,"En vivo: jura del titular del Plan Belgrano, Carlos Vignolo https://t.co/4UnoqgRSfk"
Argentina,900507212212314113,2017-08-23 23:57:04,"Mis condolencias a familiares y amigos de Eduardo Angeloz, histórico dirigente radical y siempre comprometido con los valores democráticos"
Argentina,900484217766903808,2017-08-23 22:25:42,Hoy me reuní con el equipo argentino de emprendedores que ganó el tercer premio en la copa Imagine de Microsoft https://t.co/8jf5WzznNr
Argentina,900121834380808192,2017-08-22 22:25:43,"Hoy me reuní con Kristine Tompkins, quien el año pasado donó más de 20 mil hectáreas para la creación del parque na https://t.co/p1SKXemG00"
Argentina,900091212773953536,2017-08-22 20:24:02,En vivo: el presidente Macri recibe a jóvenes que accedieron a su primer empleo https://t.co/kqJ3CygFeG
Argentina,898647036119195648,2017-08-18 20:45:24,"También me reuní con el embajador en España, Ramón Puerta, para poner el gobierno a disposición de los argentinos h https://t.co/NzrvNtvMZB"
Argentina,898646625446395905,2017-08-18 20:43:46,Hoy me comuniqué con el presidente Rajoy para transmitir la solidaridad del pueblo argentino frente al atentado en Barcelona
Argentina,898296487607767041,2017-08-17 21:32:26,"Recibí a Claudio Poggi, nuestro candidato a senador en San Luis, para felicitarlo por su triunfo el domingo pasado https://t.co/kxWPp7hSxS"
Argentina,898276311545683969,2017-08-17 20:12:16,Reunión en Olivos con los integrantes de la Mesa de Ganados y Carnes https://t.co/XLgTeQqRD4
Argentina,898268754693554180,2017-08-17 19:42:14,Consternado por el atentado terrorista que golpeó hoy Barcelona. Toda mi solidaridad con las víctimas y con el pueblo español.
Argentina,898218996012634112,2017-08-17 16:24:31,RT @JimYongKim: Gran intercambio de ideas con @mauriciomacri sobre el futuro prometedor de #Argentina y la próxima Presidencia del #G20. ht
Argentina,898210203837050881,2017-08-17 15:49:35,"VIVO: declaración del presidente Macri y el presidente del Banco Mundial, Jim Yong Kim https://t.co/BBWvZfc9xT https://t.co/Ru4rFo9YgK"
Argentina,897929318562529280,2017-08-16 21:13:26,"En Olivos me reuní con Sebastián Piñera, ex presidente de Chile https://t.co/q4O6w3T5Ah"
Argentina,897504837415325696,2017-08-15 17:06:42,"Recibimos a Mike Pence, vicepresidente de los Estados Unidos https://t.co/Ptwzne5hCB"
Argentina,897484668718788614,2017-08-15 15:46:34,"En vivo: declaración conjunta del presidente Macri y el vicepresidente de los Estados Unidos, Mike Pence. @VP https://t.co/J6KBihAth5"
Argentina,896927584881172480,2017-08-14 02:52:55,"¡Sí se puede! ¡Claro que se puede! ¡A trabajar juntos, gracias! https://t.co/fszEBPRXxq"
Argentina,896926257585074177,2017-08-14 02:47:38,Este equipo de 40 millones de argentinos tiene que ser la generación que cambie la historia del país para siempre.
Argentina,896926205932339200,2017-08-14 02:47:26,"Ustedes me han hecho fanático de los argentinos. Cuanto más los conozco, más convencido estoy de todo lo que podemos hacer."
Argentina,896926037216546817,2017-08-14 02:46:46,La idea del cambio crece en nuestro corazón. Sentimos que podemos y merecemos tener un futuro mejor.
Argentina,896925927904600064,2017-08-14 02:46:19,Liderar a partir de la confrontación no genera un mejor futuro. No genera un desarrollo sano. La energía es una sola.
Argentina,896925863735853060,2017-08-14 02:46:04,Me comprometo a seguir invitando a la oposición a trabajar en políticas de largo plazo porque creo en eso
Argentina,896925819494436864,2017-08-14 02:45:54,¿Cómo puede ser que la oposición que gobernó los últimos 20 años ponga palos en la rueda y ofrezca soluciones a los problemas que dejó?
Argentina,896925695741382656,2017-08-14 02:45:24,Todos juntos tenemos que llegar a ese destino de felicidad. El desafío es darle a todos los argentinos una mejor oportunidad
Argentina,896925605362520064,2017-08-14 02:45:03,"Hemos tenido que tomar decisiones difíciles. Pero quiero que sepan que en cada una pensé en ustedes, lo hice convencido por nuestro futuro"
Argentina,896925428455178240,2017-08-14 02:44:20,El cambio crece. Este sentimiento crece.
Argentina,896925378782019587,2017-08-14 02:44:09,"Felicitaciones a María Eugenia, a todo el equipo y a los bonaerenses por haber acompañado."
Argentina,896925312122052608,2017-08-14 02:43:53,Felicitaciones y gracias a nuestros candidatos. Quiero felicitar a todo el equipo.
Argentina,896925246640406528,2017-08-14 02:43:37,"Hemos recuperado la capacidad de soñar, de creer en nosotros mismos. No vamos a escuchar más los discursos del miedo y la resignación."
Argentina,896925095393939456,2017-08-14 02:43:01,Tenemos que trabajar en equipo. Siempre vamos a ser más juntos que tirando para distintos lados.
Argentina,896924700680404994,2017-08-14 02:41:27,"Nos hemos comprometido a crecer sobre bases sólidas. Lo tenemos que hacer desde la verdad, terminando con el engaño."
Argentina,896924613850136577,2017-08-14 02:41:06,Los argentinos aprendimos que lo que vale no se hace de un día para el otro. Se hace dando un paso todos los días y eso empezamos a hacer.
Argentina,896924506375073793,2017-08-14 02:40:41,Gracias a cada argentino que fue a votar para decir que el cambio está más vivo que nunca.
Argentina,896924432400175104,2017-08-14 02:40:23,"Quiero felicitar a todos los argentinos por esta jornada maravillosa que tuvimos, en paz. Me siento muy orgulloso."
Argentina,896924383301718018,2017-08-14 02:40:11,¡Qué lindo día en la historia de nuestro país! En estas horas vivimos mucha emoción
Argentina,896910508229619719,2017-08-14 01:45:03,En vivo desde Costa Salguero: https://t.co/YiU2FhxSOK
Argentina,896764617770373120,2017-08-13 16:05:20,Votando https://t.co/nmgXONI5gh
Argentina,896013227582205952,2017-08-11 14:19:35,Agradezco al Emir de Qatar y a Nasser Al-Khelaifi por la ayuda que brindaron para que la familia Agüero pueda regresar a la Argentina
Argentina,895769392872644608,2017-08-10 22:10:40,En vivo: cierre de campaña desde Córdoba https://t.co/AZSHHU2uZM https://t.co/dZGtacOFrj
Argentina,895759364744761344,2017-08-10 21:30:49,#YoNoAflojo https://t.co/HU3oEvl2OQ
Argentina,895670440227516417,2017-08-10 15:37:28,"Recibí a los Pumpas XV, el equipo nacional de rugby inclusivo que va a representarnos en el Mundial España 2017 https://t.co/aSE8mrYBNz"
Argentina,895364852457385990,2017-08-09 19:23:10,"""Argentina arrancó y estamos comprometidos con nuestro futuro. Creemos de corazón en lo que estamos haciendo. ¡Vamo https://t.co/86YOMgidXf"
Argentina,895311385105707009,2017-08-09 15:50:42,En vivo desde Ferro: https://t.co/T29Iz8wrVS
Argentina,894989395979378689,2017-08-08 18:31:14,Con los candidatos de la provincia de Buenos Aires en Azul https://t.co/a2VzZDkmYT
Argentina,894988165152473088,2017-08-08 18:26:21,"En Azul visité el frigorífico Devesa. Después de haber cerrado hace 7 años, en marzo se reactivó y ya generó 500 em https://t.co/pBAedPqeji"
Argentina,894954202065240069,2017-08-08 16:11:23,En vivo desde Azul https://t.co/MZ5dm1TUlU
Argentina,894637211903295489,2017-08-07 19:11:47,Recibimos a Daniel Barenboim y a Elena Bashkírova en la Casa Rosada https://t.co/Bnf3Dwfo4b
Argentina,894236519128600577,2017-08-06 16:39:34,En el Autódromo de Buenos Aires celebramos los 80 años del TC https://t.co/nXAqd4ypp0
Argentina,893889750758825985,2017-08-05 17:41:38,Esta mañana en Gualeguaychú https://t.co/GmUCgbhmfn
Argentina,893840162236616704,2017-08-05 14:24:36,En vivo desde Gualeguaychú https://t.co/OodmWd3EpE
Argentina,893578192182796288,2017-08-04 21:03:37,#Cambiemos https://t.co/IymyMnrIZp
Argentina,893537512869810176,2017-08-04 18:21:58,En Bahía Blanca con los candidatos de la provincia de Buenos Aires https://t.co/rKBolGGn4z
Argentina,893186877519429633,2017-08-03 19:08:40,"Vamos a retirarle a Nicolás Maduro la Orden del General San Martín, por la violación sistemática de su gobierno a los derechos humanos"
Argentina,893186749869850624,2017-08-03 19:08:10,"Como país democrático, la Argentina tiene la posición definida de que Venezuela debe ser suspendida del Mercosur"
Argentina,893123406438313988,2017-08-03 14:56:28,"Recibimos a Diego Iglesias y a Santiago Marquevich, fiscales que intervienen en causas contra el narcotráfico y los https://t.co/dOybQWnCXH"
Argentina,892906948789768193,2017-08-03 00:36:20,En Jujuy rendimos homenaje a la Pachamama https://t.co/ffN7RUmq5h
Argentina,892887114630799360,2017-08-02 23:17:31,Encuentro de Cambiemos en Jujuy https://t.co/iVEk0cBPcW
Argentina,892843109041569793,2017-08-02 20:22:40,En vivo desde Jujuy https://t.co/ELg8ggM87p
Argentina,892804638071762954,2017-08-02 17:49:47,"Recibí en Olivos a Philip Hammond, canciller de la Hacienda del Reino Unido https://t.co/aHEFdQT3bq"
Argentina,892557475823726592,2017-08-02 01:27:39,En el Teatro Colón con el maestro Daniel Barenboim https://t.co/9DOX6cRNQH
Argentina,892507918515544064,2017-08-01 22:10:44,Con el gobernador Colombi y los candidatos del frente en Corrientes https://t.co/6PjajgpzLZ
Argentina,892481301864906752,2017-08-01 20:24:58,En vivo desde Corrientes https://t.co/Nu7Q4cRA0o
Argentina,892194858475147264,2017-08-01 01:26:45,Encuentro de Cambiemos en Santa Fe https://t.co/UczJvf2Ckm
Argentina,892176585754804224,2017-08-01 00:14:08,En estas horas de incertidumbre quiero enviarle a los venezolanos todo mi apoyo. Manténganse unidos y llenos de esp https://t.co/LRkO2OTS73
Argentina,892142279015751681,2017-07-31 21:57:49,Me reuní con el gobernador Lifschitz en Santa Fe https://t.co/IU49M3QnBe
Argentina,892117067775791105,2017-07-31 20:17:38,En vivo desde Santa Fe: https://t.co/6MY4M34F1L
Argentina,891297176969555971,2017-07-29 13:59:41,En vivo: inauguración de la Exposición Rural https://t.co/mqO4aR4iWX
Argentina,890966166025449473,2017-07-28 16:04:21,En vivo desde Tandil: https://t.co/xBRxfTO4Yv
Argentina,890704735455543296,2017-07-27 22:45:32,En Misiones me reuní con el gobernador Passalacqua https://t.co/nlabEZQcf1
Argentina,890690184693592064,2017-07-27 21:47:42,HOY #SigamosCambiandoJuntos https://t.co/xpOif6rx5g
Argentina,890671972509667329,2017-07-27 20:35:20,En vivo desde Misiones: https://t.co/lN9xI2BMZm
Argentina,890654149511176192,2017-07-27 19:24:31,"Recibimos a Cocho López, a Gastón y a Hugo Mazzacane en Casa Rosada https://t.co/sUXCarngNL"
Argentina,890281977089339392,2017-07-26 18:45:38,En Tucumán me reuní con cinco beneficiarios de los créditos Argenta https://t.co/rrxWTGrFHK
Argentina,890232754113261568,2017-07-26 15:30:02,En vivo desde Tucumán https://t.co/wT33ZTtqNc
Argentina,890004994124128256,2017-07-26 00:25:00,"RT @Aerolineas_AR: ¡Batimos el #récord histórico de pasajeros transportados en un mismo día!  Fue ayer, 24 de julio, cuando transportamo"
Argentina,889605671305576451,2017-07-24 21:58:14,"Me visitó en Olivos Alphonse Tchami, ex jugador de Boca y manager de la selección de Camerún https://t.co/KlAuhhsQTx"
Argentina,888913597568606209,2017-07-23 00:08:11,"Nada detendrá a la revolución de los vuelos que está en marcha uniendo al país, llevando cada vez a más argentinos con mejores tarifas"
Argentina,888913486641852416,2017-07-23 00:07:45,"Nos llega esta condena en el mejor momento de la historia de Aerolíneas y los vuelos comerciales,con récord total de pasajeros transportados"
Argentina,888913413702811648,2017-07-23 00:07:27,Por la inmensa torpeza y arrogancia que el gobierno anterior tuvo con Aerolíneas el país fue condenado a pagar US$320 millones más intereses
Argentina,888489614427783168,2017-07-21 20:03:26,En vivo: el Presidente en Mendoza https://t.co/fk6QqBn2jc
Argentina,888484235702566912,2017-07-21 19:42:03,"Mantuvimos reuniones bilaterales con los presidentes de Uruguay, Bolivia y Paraguay https://t.co/e5vdujoKLB"
Argentina,888430626126409728,2017-07-21 16:09:02,En vivo: palabras del Presidente en la cumbre de Mercosur. #Mercosur2017 https://t.co/sqyQreRvqm
Argentina,888414522524012544,2017-07-21 15:05:02,Ahora en Mendoza: cumbre de jefes de Estado del Mercosur. #Mercosur2017 https://t.co/KIzxv8FFgg
Argentina,888061105192542209,2017-07-20 15:40:41,"Recibí a Susana, Walter y Graciela para agradecerles la solidaridad de donar los órganos de sus hijos en el momento https://t.co/IDD4m5A9E1"
Argentina,887646267752546305,2017-07-19 12:12:16,En vivo: puesta en marcha de la tuneladora de la obra Sistema Riachuelo https://t.co/OYTSRLcCZT
Argentina,887450906769465344,2017-07-18 23:15:58,El 23º aniversario de la tragedia de AMIA nos enseña una vez más que más justicia es más democracia. #YoNoOlvido #AMIA
Argentina,887421235319246848,2017-07-18 21:18:04,En vivo: palabras del Presidente en el marco de la quema de droga incautada al narcotráfico https://t.co/p0ngrdTlvh
Argentina,887090186001281024,2017-07-17 23:22:36,CAMBIAR. Los vecinos que esperaban el colectivo a la intemperie ahora lo harán más cómodos y seguros en el Centro d https://t.co/2OVv8rwNr1
Argentina,887033107127439360,2017-07-17 19:35:47,Gracias @EstebanBullrich y @JulioMartinezLR por su convicción y dedicación plena. Su aporte es muy importante para Buenos Aires y La Rioja.
Argentina,886965669677457408,2017-07-17 15:07:49,En vivo: inauguración del Centro de Trasbordo de La Matanza https://t.co/pVVxCPsZhn
Argentina,886951271609110528,2017-07-17 14:10:36,En vivo: jura de los ministros Finocchiaro y Aguad https://t.co/GMVnGOoanT
Argentina,886737598080831488,2017-07-17 00:01:32,"""¿De quién son las cosas?"" https://t.co/uHfstGfQeG"
Argentina,886244329437753344,2017-07-15 15:21:28,RT @mariuvidal: Junto a @mauriciomacri recorrimos el barrio que tantas veces caminé cuando era chica. #LaProvinciaSomosTodos https://t.co/z
Argentina,886042715967893505,2017-07-15 02:00:20,Hoy fui a la parrilla de Beto en Cañuelas https://t.co/rchv5XQ59D
Argentina,885990411482935299,2017-07-14 22:32:29,"Recibí en Olivos a Agustín Zbar, titular de la AMIA https://t.co/Cs9Hv2WUHT"
Argentina,885978888261730304,2017-07-14 21:46:42,"""¿Podrán?"" https://t.co/V58NckDau8"
Argentina,885615670205042688,2017-07-13 21:43:24,Celebramos el 70º aniversario de la ley que habilitó el voto femenino. Pancha donó la libreta con la que votó ese p https://t.co/Hn35jROSId
Argentina,885338784929378305,2017-07-13 03:23:09,Homenajeamos a René Favaloro a 50 años de la primera intervención de bypass https://t.co/9JcgM3g9bS
Argentina,885299669605249025,2017-07-13 00:47:43,Hace un tiempo lo llamé a Luis y le prometí visitarlo cuando estuviera en Córdoba. Hoy fui. https://t.co/xtZyVRHmtz
Argentina,885263384068980741,2017-07-12 22:23:32,"Recibí en Olivos a Michael Punke, el vicepresidente de Política Pública Mundial de Amazon https://t.co/DV3kDedI9t"
Argentina,885207195478110208,2017-07-12 18:40:16,"En Córdoba visité a Héctor y Carlos, los hermanos que desarrollaron una aplicación que facilita la comunicación a p https://t.co/3uMM28kauq"
Argentina,885144794011455488,2017-07-12 14:32:18,En vivo: conferencia de prensa desde Córdoba https://t.co/KlA5OHjAIu
Argentina,884782383538593793,2017-07-11 14:32:13,Nueva reunión de gabinete esta mañana en la Casa Rosada https://t.co/qeKS7DEX6Y
Argentina,884218199688065024,2017-07-10 01:10:21,Muchas gracias @HLavandera por la extraordinaria ejecución del Himno Nacional en el piano histórico donde se estrenó https://t.co/sBcli5wTiw
Argentina,884196939587256320,2017-07-09 23:45:52,9 de Julio en la Fragata Libertad https://t.co/9H48jL8Dys
Argentina,884032359305228289,2017-07-09 12:51:53,¡Feliz 9 de Julio!  https://t.co/vf6ToZ5QWZ
Argentina,883882237518905344,2017-07-09 02:55:21,Esperando en vivo el 9 de Julio: https://t.co/llWddNceHC
Argentina,883679134551089153,2017-07-08 13:28:18,"También nos reunimos con el primer ministro de Singapur, Lee Hsien Loong, y con el presidente de Turquía, Recep Tay https://t.co/bamCL41Ls8"
Argentina,883674684751044609,2017-07-08 13:10:37,Reunión bilateral con el primer ministro Narendra Modi en Hamburgo https://t.co/ZBdqNPQhrP
Argentina,883672750832967681,2017-07-08 13:02:56,Nos alegra mucho saber que @leopoldolopez ya está con su familia. Esperamos que pronto los demás presos políticos puedan hacer lo mismo.
Argentina,883479654518181888,2017-07-08 00:15:38,"Despedimos con cariño a Landrú, un referente del humor político. Mis condolencias a sus familiares y amigos https://t.co/PDxP936YtM"
Argentina,883352159571542018,2017-07-07 15:49:01,Un orgullo: el Parque Nacional Los Alerces es ahora uno de los tesoros del planeta https://t.co/ydfHylygsN
Argentina,883288981282201602,2017-07-07 11:37:58,"China, Argentina, Alemania y Estados Unidos. Ya estamos reunidos en Hamburgo para un nuevo encuentro del G20. https://t.co/4S1qdh7VIc"
Argentina,883114180219461632,2017-07-07 00:03:22,"En Hamburgo también nos reunimos con Justin Trudeau, primer ministro de Canadá https://t.co/pqBCNEfcZ5"
Argentina,883087574591574017,2017-07-06 22:17:39,"Con @Shakira y Juliana en el festival de Global Citizen, la plataforma de acción social que busca resolver los prin https://t.co/CBzGfWrZdt"
Argentina,882940544233725952,2017-07-06 12:33:24,Ya estoy en Hamburgo para el encuentro del G20 https://t.co/I9VkaOLftH
Argentina,882362923892473857,2017-07-04 22:18:09,"Recibí a las autoridades del Instituto Balseiro, del Centro Atómico Bariloche y de la Comisión Nacional de Energía https://t.co/vnyRU1sz2u"
Argentina,882255056489336834,2017-07-04 15:09:31,Tuvimos una nueva reunión de gabinete ampliado en @elCCKoficial https://t.co/FswjEjr1kw
Argentina,881998902823702530,2017-07-03 22:11:39,Hoy recibí a los directivos de Mercado Libre para conocer los  detalles del plan de inversión y de expansión de la https://t.co/XKDT0Tiyjf
Argentina,881941095705436160,2017-07-03 18:21:57,"RT @Guillodietrich: Volvió el #TrenAMarDelPlata con servicio diario! Salimos esta mañana después de renovar vías y puentes, y mejorar estac"
Argentina,881880295955472385,2017-07-03 14:20:21,En vivo: homenaje a los policías federales caídos en cumplimiento del deber. https://t.co/7lqhwAhuoF
Argentina,881299903334330369,2017-07-01 23:54:05,"En minutos estrenamos en vivo por Facebook el documental ""Argentina Wild"" de Nat Geo. Para verlo: https://t.co/BU3cW3Tmb7"
Argentina,880896487185690624,2017-06-30 21:11:03,En Luján nos reunimos con alumnos de la UNLu que ya usan el Boleto Estudiantil Gratuito https://t.co/V7ROyBq1VU
Argentina,880557451757723649,2017-06-29 22:43:51,Nos reunimos con representantes de las empresas mineras que van a invertir en proyectos de litio en Jujuy https://t.co/IieuIPX14C
Argentina,880530354922070016,2017-06-29 20:56:10,En vivo: el Presidente visita la sede de la Confederación Argentina de la Mediana Empresa https://t.co/RkAmeEGqGz
Argentina,880519750505254912,2017-06-29 20:14:02,"Recibí al investigador del CONICET y miembro de la Academia de Ciencias de Estados Unidos, Gabriel Rabinovich, y a https://t.co/7dPbIqS6P3"
Argentina,880508570244177920,2017-06-29 19:29:36,Presentamos el primer informe en siete años sobre consumo de drogas en el país https://t.co/DZBKXxiHNu
Argentina,880176572162080770,2017-06-28 21:30:22,"Recibí a Ernesto Calvo, el científico argentino ganador del Bright Minds Challenge por su proyecto sobre litio y en https://t.co/2qYvxUx982"
Argentina,880138450422444032,2017-06-28 18:58:53,Almorcé en Olivos con un grupo de emprendedores de la provincia de Buenos Aires para charlar sobre el registro PYME https://t.co/KQBhhsRaOs
Argentina,880062204942450688,2017-06-28 13:55:55,Reunión de gabinete en Olivos https://t.co/AGoZrcoWD5
Argentina,879866610839953409,2017-06-28 00:58:41,En Chile me reuní con autoridades de la Sociedad de Fomento Fabril y de la Confederación de la Producción y el Come https://t.co/6jNGmuGZtA
Argentina,879809851634987008,2017-06-27 21:13:09,"Feliz día a los empleados estatales que trabajan por un Estado más moderno, cercano y transparente todos los días"
Argentina,879806765046652929,2017-06-27 21:00:53,Reunión ampliada con las comitivas de la Argentina y Chile https://t.co/YbugD69s0z
Argentina,879769898456666112,2017-06-27 18:34:23,Mantuvimos una reunión bilateral con la presidenta Bachelet en el Palacio de la Moneda https://t.co/9kcHFkinxs
Argentina,879763927319666688,2017-06-27 18:10:40,En vivo: declaración conjunta con la presidenta Bachelet https://t.co/UxhTkefHsj
Argentina,879533695530651648,2017-06-27 02:55:48,"Lamento profundamente la partida del Momo Venegas, un defensor de los derechos de los trabajadores rurales. Todo mi cariño a su familia."
Argentina,879152279479357440,2017-06-26 01:40:11,Estamos a disposición de las autoridades de la provincia para asistir en lo que sea necesario.
